{
  "kind": "ZaakTypeDefinition",
  "id": "omgevingswet/19",
  "version": "1.9",
  "title": "Bibob-onderzoek uitvoeren",
  "source": {
    "kind": "ztc-xlsx",
    "file": "19_-_Bibob-onderzoek_uitvoeren_V1_9.xlsx",
    "catalog_file": "00_-_Zaaktypecatalogus_Omgevingswet_V1_9.xlsx",
    "imported_at": "2026-05-06T10:11:19+00:00"
  },
  "metadata": {
    "IDENTIFICATIE": {
      "value": "19",
      "source_ref": {
        "file": "19_-_Bibob-onderzoek_uitvoeren_V1_9.xlsx",
        "sheet": "Zaaktype",
        "row": 3
      }
    },
    "OMSCHRIJVING": {
      "value": "Bibob-onderzoek uitvoeren",
      "source_ref": {
        "file": "19_-_Bibob-onderzoek_uitvoeren_V1_9.xlsx",
        "sheet": "Zaaktype",
        "row": 4
      }
    },
    "CATEGORIE": {
      "value": "Evaluatie uitvoeren",
      "source_ref": {
        "file": "19_-_Bibob-onderzoek_uitvoeren_V1_9.xlsx",
        "sheet": "Zaaktype",
        "row": 5
      }
    },
    "DOEL": {
      "value": "Het vaststellen van de integriteit van de aanvrager van een vergunning.",
      "source_ref": {
        "file": "19_-_Bibob-onderzoek_uitvoeren_V1_9.xlsx",
        "sheet": "Zaaktype",
        "row": 6
      }
    },
    "AANLEIDING": {
      "value": "Deze zaak wordt intern getriggerd naar aanleiding van een aanvraag voor de in de Wet Bibob genoemde vergunningsoort, waarbij het nodig is om onderzoek te doen naar de integriteit van de aanvrager.",
      "source_ref": {
        "file": "19_-_Bibob-onderzoek_uitvoeren_V1_9.xlsx",
        "sheet": "Zaaktype",
        "row": 7
      }
    },
    "TOELICHTING": {
      "value": "Dit zaaktype betreft het uitvoeren van een Bibob-onderzoek. Wanneer de gemeente een aanvraag heeft ontvangen voor de in de Wet Bibob genoemde vergunningsoort kan zij een onderzoek doen naar de integriteit van de aanvrager of de inschrijver. De gemeente kan hiervoor gebruik maken van de diensten van het Bureau Bibob. Deze zaak vormt een deelzaak van de vergunningsprocedure. Het resultaat van het onderzoek is herbruikbaar voor een periode van vijf jaar.",
      "source_ref": {
        "file": "19_-_Bibob-onderzoek_uitvoeren_V1_9.xlsx",
        "sheet": "Zaaktype",
        "row": 8
      }
    },
    "INITIATIE EXTERN / INTERN": {
      "value": "Intern",
      "source_ref": {
        "file": "19_-_Bibob-onderzoek_uitvoeren_V1_9.xlsx",
        "sheet": "Zaaktype",
        "row": 9
      }
    },
    "HANDELING INITIATOR": {
      "value": "Aanvraag",
      "source_ref": {
        "file": "19_-_Bibob-onderzoek_uitvoeren_V1_9.xlsx",
        "sheet": "Zaaktype",
        "row": 10
      }
    },
    "ONDERWERP": {
      "value": "Bibob-onderzoek",
      "source_ref": {
        "file": "19_-_Bibob-onderzoek_uitvoeren_V1_9.xlsx",
        "sheet": "Zaaktype",
        "row": 11
      }
    },
    "HANDELING BEHANDELAAR": {
      "value": "Uitvoeren",
      "source_ref": {
        "file": "19_-_Bibob-onderzoek_uitvoeren_V1_9.xlsx",
        "sheet": "Zaaktype",
        "row": 12
      }
    },
    "DOORLOOPTIJD BEHANDELING (KALENDERDAGEN) (2.1)": {
      "value": "84",
      "source_ref": {
        "file": "19_-_Bibob-onderzoek_uitvoeren_V1_9.xlsx",
        "sheet": "Zaaktype",
        "row": 13
      }
    },
    "- DOORLOOPTIJD - PERIODE-EENHEID (2.2)": {
      "value": "Week",
      "source_ref": {
        "file": "19_-_Bibob-onderzoek_uitvoeren_V1_9.xlsx",
        "sheet": "Zaaktype",
        "row": 17
      }
    },
    "- DOORLOOPTIJD - PERIODEDUUR (2.2)": {
      "value": "4",
      "source_ref": {
        "file": "19_-_Bibob-onderzoek_uitvoeren_V1_9.xlsx",
        "sheet": "Zaaktype",
        "row": 18
      }
    },
    "SERVICENORM BEHANDELING (KALENDERDAGEN) (2.1)": {
      "value": "28",
      "source_ref": {
        "file": "19_-_Bibob-onderzoek_uitvoeren_V1_9.xlsx",
        "sheet": "Zaaktype",
        "row": 16
      }
    },
    "OPSCHORTING / AANHOUDING MOGELIJK": {
      "value": "Nee",
      "source_ref": {
        "file": "19_-_Bibob-onderzoek_uitvoeren_V1_9.xlsx",
        "sheet": "Zaaktype",
        "row": 19
      }
    },
    "VERLENGING MOGELIJK": {
      "value": "Ja",
      "source_ref": {
        "file": "19_-_Bibob-onderzoek_uitvoeren_V1_9.xlsx",
        "sheet": "Zaaktype",
        "row": 20
      }
    },
    "VERLENGINGSTERMIJN": {
      "value": "28",
      "source_ref": {
        "file": "19_-_Bibob-onderzoek_uitvoeren_V1_9.xlsx",
        "sheet": "Zaaktype",
        "row": 21
      }
    },
    "TREFWOORDEN": {
      "value": "Bibob, onderzoek, controle",
      "source_ref": {
        "file": "19_-_Bibob-onderzoek_uitvoeren_V1_9.xlsx",
        "sheet": "Zaaktype",
        "row": 22
      }
    },
    "VERTROUWELIJKHEIDAANDUIDING": {
      "value": "Zaakvertrouwelijk",
      "source_ref": {
        "file": "19_-_Bibob-onderzoek_uitvoeren_V1_9.xlsx",
        "sheet": "Zaaktype",
        "row": 23
      }
    },
    "PUBLICATIE-INDICATIE": {
      "value": "Nee",
      "source_ref": {
        "file": "19_-_Bibob-onderzoek_uitvoeren_V1_9.xlsx",
        "sheet": "Zaaktype",
        "row": 25
      }
    },
    "- BRON": {
      "value": "Basisarchiefcode",
      "source_ref": {
        "file": "19_-_Bibob-onderzoek_uitvoeren_V1_9.xlsx",
        "sheet": "Zaaktype",
        "row": 35
      }
    },
    "- CODE (2.1)": {
      "value": "-1.87",
      "source_ref": {
        "file": "19_-_Bibob-onderzoek_uitvoeren_V1_9.xlsx",
        "sheet": "Zaaktype",
        "row": 36
      }
    },
    "VERSIEDATUM": {
      "value": "2025-12-18",
      "source_ref": {
        "file": "19_-_Bibob-onderzoek_uitvoeren_V1_9.xlsx",
        "sheet": "Zaaktype",
        "row": 43
      }
    },
    "DATUM BEGIN GELDIGHEID": {
      "value": "2021-11-30",
      "source_ref": {
        "file": "19_-_Bibob-onderzoek_uitvoeren_V1_9.xlsx",
        "sheet": "Zaaktype",
        "row": 44
      }
    }
  },
  "statuses": [
    {
      "id": "1_zaak_gestart",
      "sequence": 1,
      "title": "Zaak gestart",
      "inform_citizen": false,
      "required_documents": [],
      "required_objects": [],
      "required_properties": [],
      "source_ref": {
        "file": "19_-_Bibob-onderzoek_uitvoeren_V1_9.xlsx",
        "sheet": "Statussen",
        "row": 3
      },
      "duration": {
        "value": 0,
        "unit": "unknown"
      },
      "description": "De zaak is geregistreerd, maar is nog geen sprake van een afgeronde registratie. Bepaald is via welk kanaal / welke kanalen met de aanvrager gecommuniceerd wordt / moet worden.",
      "valid_from": "2021-11-30"
    },
    {
      "id": "2_intake_afgerond",
      "sequence": 2,
      "title": "Intake afgerond",
      "inform_citizen": false,
      "required_documents": [],
      "required_objects": [],
      "required_properties": [],
      "source_ref": {
        "file": "19_-_Bibob-onderzoek_uitvoeren_V1_9.xlsx",
        "sheet": "Statussen",
        "row": 4
      },
      "duration": {
        "value": 2,
        "unit": "unknown"
      },
      "description": "De zaak is geregistreerd en gerelateerd aan de zaak waarin gerelateerde aanvraag wordt behandeld.\nDe behandelend medewerker of het behandelend organisatieonderdeel is bepaald.",
      "valid_from": "2021-11-30"
    },
    {
      "id": "3_onderzoek_uitgevoerd",
      "sequence": 3,
      "title": "Onderzoek uitgevoerd",
      "inform_citizen": false,
      "required_documents": [
        "Formulier bevindingen eigen onderzoek",
        "Verzoek advies bureau Bibob",
        "Advies"
      ],
      "required_objects": [],
      "required_properties": [],
      "source_ref": {
        "file": "19_-_Bibob-onderzoek_uitvoeren_V1_9.xlsx",
        "sheet": "Statussen",
        "row": 5
      },
      "duration": {
        "value": 66,
        "unit": "unknown"
      },
      "description": "Het eigen onderzoek en het onderzoek van het Landelijk Bureau Bibob is uitgevoerd. Het advies van het Landelijk Bureau Bibob is ontvangen.",
      "valid_from": "2021-11-30"
    },
    {
      "id": "4_adviesrapport_opgesteld",
      "sequence": 4,
      "title": "Adviesrapport opgesteld",
      "inform_citizen": false,
      "required_documents": [
        "Adviesrapport (intern)"
      ],
      "required_objects": [],
      "required_properties": [],
      "source_ref": {
        "file": "19_-_Bibob-onderzoek_uitvoeren_V1_9.xlsx",
        "sheet": "Statussen",
        "row": 6
      },
      "duration": {
        "value": 15,
        "unit": "unknown"
      },
      "description": "Het adviesrapport naar aanleiding van het Bibob onderzoek is opgesteld.",
      "valid_from": "2021-11-30"
    },
    {
      "id": "5_zaak_afgerond",
      "sequence": 5,
      "title": "Zaak afgerond",
      "inform_citizen": false,
      "required_documents": [],
      "required_objects": [],
      "required_properties": [],
      "source_ref": {
        "file": "19_-_Bibob-onderzoek_uitvoeren_V1_9.xlsx",
        "sheet": "Statussen",
        "row": 7
      },
      "duration": {
        "value": 1,
        "unit": "unknown"
      },
      "description": "Het advies is verstrekt aan de behandelaar van de vergunningaanvraag. \nIndien nodig zijn vervolgacties in gang gezet (d.m.v. het plannen van andere zaken). Het zaakdossier is afgesloten en gearchiveerd.",
      "valid_from": "2021-11-30"
    }
  ],
  "transitions": [
    {
      "id": "1_zaak_gestart__to__2_intake_afgerond",
      "from": "1_zaak_gestart",
      "to": "2_intake_afgerond",
      "source": "inferred_from_status_order",
      "mode": "manual",
      "when": {
        "status.is": "1_zaak_gestart"
      },
      "effects": [
        {
          "status.transition": "2_intake_afgerond"
        }
      ]
    },
    {
      "id": "2_intake_afgerond__to__3_onderzoek_uitgevoerd",
      "from": "2_intake_afgerond",
      "to": "3_onderzoek_uitgevoerd",
      "source": "inferred_from_status_order",
      "mode": "manual",
      "when": {
        "status.is": "2_intake_afgerond"
      },